<?xml version="1.0" encoding="UTF-8"?>
<quiz xmlns:xsi="http://www.w3.org/2001/XMLSchema-instance" xmlns="pmdmmo"
    xsi:schemaLocation="pmdmmo xsd/quiz.xsd">
    <questions>
        <questiongroup id="0">
            <question id="0">
                <answer id="0">
                    <reward nature="Hardy" value="2"/>
                </answer>
                <answer id="1">
                    <reward nature="Relaxed" value="2"/>
                </answer>
                <answer id="2">
                    <reward nature="Impish" value="2"/>
                </answer>
            </question>
            <question id="1">
                <answer id="0">
                    <reward nature="Hardy" value="2"/>
                    <reward nature="Docile" value="1"/>
                </answer>
                <answer id="1">
                    <reward nature="Quirky" value="2"/>
                </answer>
            </question>
            <question id="2">
                <answer id="0">
                    <reward nature="Hardy" value="2"/>
                    <reward nature="Brave" value="2"/>
                </answer>
                <answer id="1">
                    <reward nature="Sassy" value="2"/>
                    <reward nature="Quirky" value="2"/>
                </answer>
            </question>
            <question id="3">
                <answer id="0">
                    <reward nature="Hardy" value="2"/>
                </answer>
                <answer id="1">
                    <reward nature="Calm" value="2"/>
                </answer>
                <answer id="2">
                    <reward nature="Quirky" value="2"/>
                </answer>
            </question>
        </questiongroup>
        <questiongroup id="1">
            <question id="0">
                <answer id="0">
                    <reward nature="Docile" value="2"/>
                    <reward nature="Naive" value="1"/>
                </answer>
                <answer id="1">
                    <reward nature="Timid" value="2"/>
                    <reward nature="Calm" value="1"/>
                </answer>
            </question>
            <question id="1">
                <answer id="0">
                    <reward nature="Docile" value="2"/>
                    <reward nature="Hasty" value="1"/>
                </answer>
                <answer id="1">
                    <reward nature="Naive" value="2"/>
                    <reward nature="Relaxed" value="1"/>
                </answer>
            </question>
            <question id="2">
                <answer id="0">
                    <reward nature="Docile" value="2"/>
                </answer>
                <answer id="1">
                    <reward nature="Naive" value="2"/>
                    <reward nature="Lonely" value="1"/>
                </answer>
                <answer id="2">
                    <reward nature="Sassy" value="2"/>
                </answer>
            </question>
            <question id="3">
                <answer id="0">
                    <reward nature="Docile" value="2"/>
                </answer>
                <answer id="1">
                    <reward nature="Naive" value="2"/>
                </answer>
                <answer id="2">
                    <reward nature="Impish" value="2"/>
                </answer>
            </question>
        </questiongroup>
        <questiongroup id="2">
            <question id="0">
                <answer id="0">
                    <reward nature="Brave" value="3"/>
                    <reward nature="Impish" value="1"/>
                </answer>
                <answer id="1">
                    <reward nature="Docile" value="2"/>
                    <reward nature="Timid" value="1"/>
                </answer>
            </question>
            <question id="1">
                <answer id="0"/>
                <answer id="1">
                    <reward nature="Timid" value="2"/>
                </answer>
                <answer id="2">
                    <reward nature="Relaxed" value="2"/>
                </answer>
            </question>
            <question id="2">
                <answer id="0">
                    <reward nature="Brave" value="2"/>
                    <reward nature="Hardy" value="1"/>
                </answer>
                <answer id="1">
                    <reward nature="Naive" value="2"/>
                </answer>
            </question>
            <question id="3">
                <answer id="0">
                    <reward nature="Brave" value="3"/>
                </answer>
                <answer id="1">
                    <reward nature="Brave" value="2"/>
                    <reward nature="Hardy" value="2"/>
                </answer>
                <answer id="2">
                    <reward nature="Docile" value="1"/>
                    <reward nature="Timid" value="1"/>
                    <reward nature="Relaxed" value="1"/>
                </answer>
                <answer id="3">
                    <reward nature="Timid" value="2"/>
                </answer>
            </question>
        </questiongroup>
        <questiongroup id="3">
            <question id="0">
                <answer id="0">
                    <reward nature="Jolly" value="2"/>
                    <reward nature="Naive" value="1"/>
                </answer>
                <answer id="1">
                    <reward nature="Sassy" value="1"/>
                    <reward nature="Quirky" value="1"/>
                </answer>
            </question>
            <question id="1">
                <answer id="0">
                    <reward nature="Jolly" value="1"/>
                    <reward nature="Lonely" value="1"/>
                </answer>
                <answer id="1">
                    <reward nature="Timid" value="1"/>
                </answer>
            </question>
            <question id="2">
                <answer id="0">
                    <reward nature="Jolly" value="2"/>
                </answer>
                <answer id="1">
                    <reward nature="Calm" value="2"/>
                </answer>
                <answer id="1">
                    <reward nature="Quirky" value="2"/>
                </answer>
            </question>
            <question id="3">
                <answer id="0">
                    <reward nature="Jolly" value="3"/>
                </answer>
                <answer id="1">
                    <reward nature="Hardy" value="2"/>
                </answer>
                <answer id="2">
                    <reward nature="Timid" value="2"/>
                </answer>
            </question>
        </questiongroup>
        <questiongroup id="4">
            <question id="0">
                <answer id="0">
                    <reward nature="Impish" value="2"/>
                    <reward nature="Lonely" value="1"/>
                </answer>
                <answer id="1">
                    <reward nature="Calm" value="2"/>
                </answer>
            </question>
            <question id="1">
                <answer id="0">
                    <reward nature="Impish" value="2"/>
                </answer>
                <answer id="1">
                    <reward nature="Docile" value="1"/>
                    <reward nature="Relaxed" value="1"/>
                </answer>
            </question>
            <question id="2">
                <answer id="0">
                    <reward nature="Impish" value="2"/>
                    <reward nature="Hardy" value="1"/>
                </answer>
                <answer id="1">
                    <reward nature="Quirky" value="2"/>
                    <reward nature="Sassy" value="1"/>
                </answer>
            </question>
            <question id="3">
                <answer id="0">
                    <reward nature="Brave" value="3"/>
                </answer>
                <answer id="1">
                    <reward nature="Timid" value="2"/>
                </answer>
                <answer id="2">
                    <reward nature="Impish" value="2"/>
                </answer>
            </question>
        </questiongroup>
        <questiongroup id="5">
            <question id="0">
                <answer id="0">
                    <reward nature="Naive" value="3"/>
                    <reward nature="Impish" value="1"/>
                </answer>
                <answer id="1">
                    <reward nature="Jolly" value="2"/>
                </answer>
                <answer id="2">
                    <reward nature="Sassy" value="2"/>
                </answer>
            </question>
            <question id="1">
                <answer id="0">
                    <reward nature="Naive" value="2"/>
                    <reward nature="Docile" value="1"/>
                </answer>
                <answer id="1">
                    <reward nature="Quirky" value="2"/>
                </answer>
            </question>
            <question id="2">
                <answer id="0">
                    <reward nature="Naive" value="2"/>
                    <reward nature="Jolly" value="1"/>
                </answer>
                <answer id="1">
                    <reward nature="Calm" value="2"/>
                </answer>
            </question>
            <question id="3">
                <answer id="0">
                    <reward nature="Naive" value="2"/>
                </answer>
                <answer id="1">
                    <reward nature="Hasty" value="2"/>
                </answer>
            </question>
        </questiongroup>
        <questiongroup id="6">
            <question id="0">
                <answer id="0">
                    <reward nature="Timid" value="2"/>
                </answer>
                <answer id="1">